{
  "contentId": "dr-r2-323",
  "contentType": "DAILY_READING",
  "version": 1,
  "status": "PUBLISHED",
  "title": "일일 독해(러셀 2) Day 323 비문학 - 논리학 개념 읽기 - 쟁점 분석",
  "description": "일일 독해 - 정독·복기·확인",
  "targetLevel": "RUSSELL_2",
  "schoolGradeRange": {
    "min": 8,
    "max": 9
  },
  "area": "READING",
  "subArea": "NONFICTION",
  "competencies": [
    "READING"
  ],
  "tags": [
    "daily"
  ],
  "access": {
    "mode": "FREE"
  },
  "seedReward": {
    "seedType": "WHEAT",
    "count": 3,
    "multiplier": 1
  },
  "timeLimitSec": 480,
  "assets": {},
  "payload": {
    "passage": {
      "format": "TEXT",
      "paragraphs": []
    },
    "intensive": {
      "timeline": []
    },
    "recall": {
      "cards": [],
      "correctOrder": [],
      "seedPenalty": 1
    },
    "confirm": {
      "questions": []
    }
  }
}
