{
  "contentId": "dr-r2-219",
  "contentType": "DAILY_READING",
  "version": 1,
  "status": "PUBLISHED",
  "title": "일일 독해(러셀 2) Day 219 문학 - 광한루기(2)",
  "description": "일일 독해 - 정독·복기·확인",
  "targetLevel": "RUSSELL_2",
  "schoolGradeRange": {
    "min": 8,
    "max": 9
  },
  "area": "READING",
  "subArea": "LITERATURE",
  "competencies": [
    "READING"
  ],
  "tags": [
    "daily"
  ],
  "access": {
    "mode": "FREE"
  },
  "seedReward": {
    "seedType": "WHEAT",
    "count": 3,
    "multiplier": 1
  },
  "timeLimitSec": 480,
  "assets": {},
  "payload": {
    "passage": {
      "format": "TEXT",
      "paragraphs": [
        {
          "id": "p1",
          "text": "그네 뛰는 모습을 이도린이 보고 자기도 모르게 눈앞이 어질어질하여 김한에게 말했다. \"너는 저런 것을 본 적이 있느냐? 저것이 금이냐, 옥이냐? 아니면 귀신이냐? 그것도 아니면 선녀냐? 너는 저것을 아느냐?\" 김한이 대답했다. \"금도 아니고 옥도 아닙니다. 낙수에 빠져 죽은 이의 넋도 사라지고, 양대에서 구름과 비를 만들었던 여인의 일도 이제 아득하기만 한데, 어떻게 귀신 같고 선녀 같은 아가씨가 요즘 세상에 나타났겠습니까?\""
        },
        {
          "id": "p2",
          "text": "\"그렇다면 누구란 말이냐?\" \"이 사람은요......\" \"이 사람이 누구냐?\" \"도련님께서는 교방 행수 기생 월매를 기억하시는지요?\" \"저렇게 젊고 아리따운 여인을 어떻게 반쯤은 쭈글쭈글해진 노파에다 비교할 수 있느냐?\""
        },
        {
          "id": "p3",
          "text": "\"저 사람은 월매의 딸 춘향입니다. 노래도 잘하고 춤도 잘 추며 글도 잘하고 바느질도 잘하며 그 용모와 자태는 정말 절색입니다. 남원의 절색일 뿐 아니라 도내의 절색이요, 도내의 절색일 뿐 아니라 국내의 절색이라 해도 손색이 없습니다.\" 이도린이 매우 기뻐하며 말했다. \"풍류를 즐길 만한 인연이 정말이지 다른 데 있는 것이 아니구나, 네가 가서 불러 오거라.\""
        },
        {
          "id": "p4",
          "text": "\"도련님께서는 저 아이를 불러다가 무엇을 하시려고요?\" \"고운 얼굴 한번 보려고 그런다.\" \"어찌 그렇지 않을 수 있겠는가?\" \"도련님께서 저 아이를 보시고 무엇 하시려고요?\" \"내가 이 일을 하든 저 일을 하든 네가 알아서 뭘 하느냐?\" \"부른다 해도 저 아이는 오지 않을 것입니다.\" \"오고 안 오고는 저 아이한테 달렸지 너한테 달리지 않았으니, 너는 그 새 주둥이 같은 입을 그만 닥치거라.\" 이에 김한이 머리를 떨구고 갔다."
        },
        {
          "id": "p5",
          "text": "원래 춘향은 풍경을 즐기려는 옆집 여자 아이를 따라 나온 것이었다. 채색 줄로 만든 그네를 탔는데, 봄바람에 옷자락이 흐트러져 버드나무 가지를 꽉 잡은 채 그네를 멈추고 옷매무새를 바로잡으려 했다. 그때 갑자기 광한루 위에서 사람의 말소리가 들리자 춘향은 몸을 돌려 꽃그늘 속으로 들어가 숨고서는 주변을 둘러보았다."
        },
        {
          "id": "p6",
          "text": "이도린이 꽃무늬가 있는 작은 종이를 손에 쥐고 홀로 광한루 동쪽 난간에 기대어 있었는데, 그 모습이 티 없이 맑아 춘향은 은연중에 찬탄하는 말을 내뱉었다. 갑자기 김한이 바쁜 걸음으로 와서 불렀다. \"춘향 낭자 어디 있소?\" 춘향이 다시 몸을 돌려 숨었기 때문에 아무 소리도 나지 않았다. 김한이 이리저리 찾아보다가 꽃그늘에까지 와서 춘향을 발견했다.\n- 수산, 「광한루기」 -"
        }
      ]
    },
    "intensive": {
      "timeline": []
    },
    "recall": {
      "cards": [],
      "correctOrder": [],
      "seedPenalty": 1
    },
    "confirm": {
      "questions": []
    }
  }
}
