{
  "contentId": "dr-f3-159",
  "contentType": "DAILY_READING",
  "version": 1,
  "status": "PUBLISHED",
  "title": "뇌 과학과 기억의 신비",
  "description": "일일 독해 - 정독·복기·확인",
  "targetLevel": "FREGE_3",
  "schoolGradeRange": {
    "min": 6,
    "max": 6
  },
  "area": "READING",
  "subArea": "NONFICTION",
  "competencies": [
    "READING"
  ],
  "tags": [
    "daily"
  ],
  "access": {
    "mode": "FREE"
  },
  "seedReward": {
    "seedType": "WHEAT",
    "count": 3,
    "multiplier": 1
  },
  "timeLimitSec": 300,
  "assets": {},
  "payload": {
    "passage": {
      "format": "TEXT",
      "paragraphs": [
        {
          "id": "p1",
          "text": "우리 두개골의 깜깜한 어둠 속에는 광활한 둥근 우주만큼 신비롭고 복잡한 거대한 마법의 중앙 기관이 매일 힘차게 펄떡대며 깊이 조용히 살아 숨 쉽니다. 물렁하고 아주 나약한 덩어리 모양이지만 엄청나게 똑똑히 일을 처리하는 대단한 두뇌입니다. 뇌는 수백억 개의 날씬한 신경 세포인 뉴런들이 찌릿한 무서운 반짝 전기 신호를 폭포처럼 쉼 없이 주고받으며 대견하고 기적적인 놀라운 생각을 아주 치밀하게 훌륭히 만들어 버립니다. 소중한 친구와 웃으며 놀던 한여름의 눈부신 추억이나 몹시 딱딱하고 어려운 수학 공식을 머릿속에 가뿐하게 떠올리는 비밀도 바로 이 신경 사이의 작은 전기 불꽃 안에 모조리 촘촘히 꽁꽁 숨었습니다. 스쳐 가는 수많은 유용한 정보를 보석 상자처럼 예쁘게 차곡차곡 저장하고 나중에 다시 똑바로 꺼내 읽는 이 눈부신 마법 작용을 우리는 달콤히 기억이라고 당당히 부릅니다. 정교하게 움직이는 뇌 신경 덕분에 인간은 지나온 투명한 과거의 역사를 단단히 지지대로 아주 시원시원히 힘차게 딛고 영리하게 뚜벅뚜벅 앞으로 씩씩하게 일어섭니다."
        },
        {
          "id": "p2",
          "text": "새로운 뜨거운 흥미로운 경험을 멋지게 마주할 때마다 이 기억의 작은 우체국인 해마라는 뇌의 숨겨진 부분이 아주 맹렬하게 가장 먼저 몹시 쉴 새 없이 아주 빠르게 바빠집니다. 머리 한가운데에 손가락만 한 작은 해마 크기는 우리가 보고 들은 단기적인 가벼운 정보를 아주 짧게 모아두고 이것을 진짜 평생 보관해야 할 소중한 큰 지식인지 철저하게 꼼꼼히 날카롭게 평가합니다. 잠을 푹 보송보송 자는 평화로운 밤 동안 똑똑한 해마는 낮에 겪은 방대한 엄청난 일들을 요란하게 쓱쓱 예쁘게 다듬어 대뇌 껍질 쪽으로 깊숙이 단단하게 길게 배달해 버립니다. 여러 번 부지런히 요란히 반복적으로 공부하거나 무섭고 강렬한 뜨거운 슬픈 감정이 시퍼렇게 잔뜩 섞인 정보일수록 해마는 아주 중요한 절대적인 핵심 자료표로 확실히 훌륭하게 눈치채고 대대적으로 남깁니다. 그래서 벼락치기로 대충 훑어본 얄팍한 얇은 문제집 공식은 금세 훌렁 잊어버리면서 가슴이 무척 심하게 아프게 찢어졌던 첫사랑의 놀라운 기억은 우연히 낡은 향기만 맡아도 십 년이 훌쩍 지나 생생히 펑펑 요란히 살아납니다."
        },
        {
          "id": "p3",
          "text": "뉴런 세포들이 기억을 더욱 단단하고 확실하게 무겁게 꽉 붙잡아 두는 특별한 지점이 바로 튼튼한 시냅스라는 보물 같은 가느다란 고리 끈입니다. 두 개의 뉴런 세포가 전기 신호를 짜릿하게 살짝 부드럽게 주고받는 아주 좁고 신비한 이 투명한 틈새 골목길에 수많은 기억 데이터 무더기가 벽돌처럼 단단히 기록됩니다. 특정한 어떤 생각이나 훌륭한 낯선 훈련을 끈질기고 매섭게 자주 반복할수록 두 신경을 거칠게 잇는 이 시냅스의 무거운 다리는 놀라울만치 굵고 무척이나 섬세하게 대단히 튼튼해집니다. 팔의 무거운 근육을 많이 쓸수록 꽉 찬 단단한 이두박근이 부풀어 오르는 것과 마찬가지로 머리의 신경 역시 지겹고 부지런히 되뇌일수록 생각의 길이 탄탄한 고속도로처럼 아주 훌륭하게 뻥 뚫립니다. 이것이 우리가 어려운 영어 단어를 통째로 외우기 위해 수백 번을 무겁게 소리치거나 마법 같은 피아노 건반 치기를 피가 단단히 나도록 수천 번 반복 연습하는 훌륭한 진짜 생물학적인 이유입니다."
        },
        {
          "id": "p4",
          "text": "인체의 경이로운 장기인 똑똑한 두뇌는 쓰면 쓸수록 무서운 괴물처럼 거대하게 쑥쑥 건강히 아주 젊게 자라고 방치하면 순식간에 시퍼렇게 차갑게 확 쪼그라드는 놀랍고 요란스러운 섬세한 스펀지나 매우 탄력 있는 고무줄입니다. 노력을 조금도 쏟지 않고 귀찮다고 매일 멍하니 아주 요란하게 시간을 허비하며 시냅스를 자극하지 않으면 똑똑하던 아주 강하던 두뇌도 결국 나이와 상관없이 무섭도록 깜깜하게 꽉 막히고 슬피 아주 거칠게 아주 매섭게 굳어버립니다. 호기심 어린 반짝이는 큰 두 눈으로 날마다 새롭고 아름다운 예쁜 책을 탐욕스럽게 찾아 달콤하게 읽고 처음 겪는 낯선 공기와 어려운 공부에 시원스레 당당하게 땀 흘리며 힘차게 거칠게 뛰어들어야 두뇌가 빛납니다. 우리 몸에서 가장 엄청난 신비한 덩어리인 우주 그 자체인 뇌를 무한하게 영리하게 성장시키는 엄청난 비밀 열쇠는 결국 내가 지닌 지독히 무거운 인내심과 한계를 거부하는 열정적이고 훌륭한 벅찬 호기심 가득 찬 한 걸음입니다. 굳은살이 단단히 배는 생각의 눈부신 반복 훈련 과정만이 잠든 훌륭한 거인 시냅스를 깨우는 위대하고 가장 빛나는 단 하나의 강력한 거친 아주 시퍼런 생물학적 무기와 똑같습니다."
        }
      ]
    },
    "intensive": {
      "timeline": []
    },
    "recall": {
      "cards": [],
      "correctOrder": [],
      "seedPenalty": 1
    },
    "confirm": {
      "questions": []
    }
  }
}