{
  "contentId": "dr-f1-322",
  "contentType": "DAILY_READING",
  "version": 1,
  "status": "PUBLISHED",
  "title": "나뭇꾼의 정직함이 가져온 눈부신 선물",
  "description": "일일 독해 - 정독·복기·확인",
  "targetLevel": "FREGE_1",
  "schoolGradeRange": {
    "min": 4,
    "max": 4
  },
  "area": "READING",
  "subArea": "LITERATURE",
  "competencies": [
    "READING"
  ],
  "tags": [
    "daily"
  ],
  "access": {
    "mode": "FREE"
  },
  "seedReward": {
    "seedType": "WHEAT",
    "count": 3,
    "multiplier": 1
  },
  "timeLimitSec": 300,
  "assets": {},
  "payload": {
    "passage": {
      "format": "TEXT",
      "paragraphs": [
        {
          "id": "p1",
          "text": "아주 먼 옛날 깊은 산속 작은 마을에 늙은 부모님을 아주 극진하게 몹시 효도와 지극한 사랑으로 지극히 착하게 모시며 가난하지만 아주 성실한 착하고 부지런한 씩씩한 젊은 나무꾼이 살고 있었습니다. 나무꾼은 매일매일 한결같이 아침 일찍 깊고 험한 무서운 산속에 혼자 묵묵히 기어올라가 무거운 큰 도끼로 튼튼한 거친 나무를 쿵쾅쿵쾅 아주 열심히 마구 베어서 번 돈으로 정성껏 겨우 쌀을 아주 조금 사서 부모님께 매일 맛있는 예쁜 흰 밥을 따뜻하게 지어 올렸습니다."
        },
        {
          "id": "p2",
          "text": "어느 날 높은 산골짜기 아주 깊고 넓은 푸른 맑은 연못가에서 커다란 굵은 둘레의 단단한 나무를 무척이나 힘들게 이 악물며 온 힘을 다해 땀을 뚝뚝 쏟으며 열심히 크게 쾅쾅 찍고 있었는데, 그만 무거운 낡은 구식 쇠도끼가 매끄럽게 심하게 팍 미끄러지며 손에서 훅 빠져나가더니 맑고 아주 끝도 없이 깊은 시퍼런 심연의 차가운 커다란 무거운 연못 속 중심으로 아예 풍덩 물보라를 치며 깊이 빠져버리고 말았습니다. 단 하나뿐인 너무 생명줄 귀중하고 비싼 전 재산인 낡은 쇠도끼를 모두 몽땅 허무하게 순식간에 눈앞에서 잃어버린 불쌍한 나무꾼은 바닥에 완전히 털썩 헛헛하게 불쌍히 주저앉아 엉엉 큰 소리로 슬프게 땅바닥을 치며 가엽게 대성통곡하며 어린아이처럼 울었습니다."
        },
        {
          "id": "p3",
          "text": "그때 맑은 짙은 연못 한가운데에서 눈부신 하얀 수염을 멋지게 길게 가슴까지 훌쩍 늘어뜨린 아주 신비로운 놀라운 자비로운 산신령님이 번쩍 갑자기 기둥 같은 하얀 맑은 구름을 타고 눈부시게 기적처럼 등장했습니다. 산신령님은 번쩍번쩍 온통 눈부시게 아주 빛나는 엄청나게 엄청난 무거운 진귀한 황금으로 된 금도끼와 반짝이는 은도끼를 차례로 양손에 하나씩 들고 나와 가엾은 나무꾼에게 아주 천천히 조용히 점잖은 무거운 목소리로 이것이 진정 네 잃어버린 도끼더냐고 훌륭히 물었습니다. 지독하게 무척 가난한 찢어지는 가난 속에서도 거짓 욕심이 도무지 전혀 아예 진짜로 없었던 맑은 바보 같은 나무꾼은 고개를 아주 크게 절레절레 가로저으며 낡은 쇠도끼만 진짜 자기 것이라며 정직하게 똑똑하게 솔직히 대답했습니다."
        },
        {
          "id": "p4",
          "text": "산신령님은 죽을 듯 가난한 슬픈 절박한 순간에도 거짓말을 결코 아주 한 번도 치지 않는 눈부시게 맑고 정직한 순수한 가엾은 나무꾼의 맑고 당당하며 흔들림 없이 빛나는 고운 양심의 마음을 진심으로 칭찬하며 아주 환하게 예쁘게 밝게 만족스레 푸근히 웃으셨습니다. 그리고 연못 밑바닥에서 건져낸 진짜 낡은 쇠도끼는 물론, 눈부시고 최고로 비싸고 엄청난 가치의 빛나는 진귀한 값비싼 큰 금도끼와 무거운 은도끼까지 모조리 모두 한꺼번에 아주 가득 복스러운 좋은 선물로 잔뜩 풍성히 내려주셨습니다. 나무꾼은 부모님과 기뻐하며 정직함으로 큰 행복을 받았습니다."
        }
      ]
    },
    "intensive": {
      "timeline": []
    },
    "recall": {
      "cards": [],
      "correctOrder": [],
      "seedPenalty": 1
    },
    "confirm": {
      "questions": []
    }
  }
}