{
  "contentId": "dr-f1-278",
  "contentType": "DAILY_READING",
  "version": 1,
  "status": "PUBLISHED",
  "title": "튼튼한 벽돌집을 지은 막내 돼지의 지혜",
  "description": "일일 독해 - 정독·복기·확인",
  "targetLevel": "FREGE_1",
  "schoolGradeRange": {
    "min": 4,
    "max": 4
  },
  "area": "READING",
  "subArea": "LITERATURE",
  "competencies": [
    "READING"
  ],
  "tags": [
    "daily"
  ],
  "access": {
    "mode": "FREE"
  },
  "seedReward": {
    "seedType": "WHEAT",
    "count": 3,
    "multiplier": 1
  },
  "timeLimitSec": 300,
  "assets": {},
  "payload": {
    "passage": {
      "format": "TEXT",
      "paragraphs": [
        {
          "id": "p1",
          "text": "어느 숲속 마을에 사이좋은 아기 돼지 삼 형제가 살고 있었습니다. 훌쩍 자라 어른이 된 삼 형제는 독립을 하기 위해 각자 자신의 첫 집을 직접 짓기로 마음먹었습니다. 밭에서 놀기를 좋아하는 뚱뚱한 첫째 돼지는 아주 쉽고 빠르게 집을 짓고 싶어 바람에 흔들리는 짚으로 엉성한 초가집을 대충 만들었습니다."
        },
        {
          "id": "p2",
          "text": "낮잠 자기를 좋아하는 둘째 돼지 역시 집 짓는 일이 귀찮았습니다. 둘째는 숲에 가서 적당한 나뭇가지들을 대강 주워와 못질을 뚝딱거려 나무집을 지었습니다. 하지만 막내 돼지는 달랐습니다. 튼튼한 집을 짓는 것이 가장 중요하다고 생각하여 무겁고 단단한 벽돌을 하나하나 정성스럽게 며칠 동안 쌓아 올려 아주 굳건한 벽돌집을 지었습니다."
        },
        {
          "id": "p3",
          "text": "어느 날 숲속에 무시무시하고 굶주린 늑대 한 마리가 나타났습니다. 늑대는 첫째 돼지의 짚으로 만든 집을 향해 와아악 하고 큰 숨을 내뿜었고, 집은 순식간에 맥없이 날아가 버렸습니다. 깜짝 놀라 도망친 첫째와 함께 둘째 돼지의 나무집에 숨었지만, 늑대가 문을 세게 발로 차자 나무집 역시 우지끈 무너지고 말았습니다."
        },
        {
          "id": "p4",
          "text": "벌벌 떨며 도망친 두 형은 막내 돼지의 벽돌집으로 재빨리 숨어들었습니다. 늑대는 이번에도 집을 날리려고 온 힘을 다해 폐가 터져라 바람을 불었지만, 튼튼한 벽돌집은 아주 작게 끄떡도 하지 않았습니다. 결국 굴뚝으로 몰래 들어오려던 늑대는 막내가 끓여둔 뜨거운 펄펄 끓는 물에 화상을 입고 숲으로 멀리 달아났습니다. 이 동화는 귀찮더라도 기초부터 튼튼하고 성실하게 준비하는 태도가 큰 보답을 준다는 것을 말해줍니다."
        }
      ]
    },
    "intensive": {
      "timeline": []
    },
    "recall": {
      "cards": [],
      "correctOrder": [],
      "seedPenalty": 1
    },
    "confirm": {
      "questions": []
    }
  }
}
